<?xml version="1.0" encoding="UTF-8"?>
<!DOCTYPE milch SYSTEM "milch.dtd">

<milch>
	<header>
		<title>Milchprodukte</title>
		<author>Dietler Andreas</author>
		<beschreibung>Uebung zu XML, DTD, XSD und XSLT</beschreibung>
	</header>
	
	<produkt typ="Roh" menge="200ml" fettgehalt="1,25%">
		<name>Milch</name>
		<bild src="img/milch.jpg"/>
		<tier>Milch</tier>
		<beschreibung></beschreibung>
		<herkunft>Österreich</herkunft>
		<preis>1,20€</preis>
	</produkt>
	
	<footer>
		<author>Dietler Andreas</author>
		<adresse>andreas.dietler@edu.fh-joanneum.at</adresse>		
	</footer>
</milch>